{
  "name": "token-connectors",
  "description": "allo 自有连接器市场：需要用户自备 token 的连接器（GitHub / 百度网盘），凭据声明见 02 §10.1",
  "owner": {
    "name": "Agent Store docs example",
    "email": "agent-store@example.com"
  },
  "connectors": [
    {
      "id": "github-token",
      "name": "GitHub（自备 Token）",
      "name_en": "GitHub (bring your own token)",
      "description": "与官方 github 条目同一个远端 MCP 服务，但按 token 认证声明，并把 Authorization 头作为引用落点。",
      "description_en": "The same remote MCP server as the official github entry, declared as token auth with the Authorization header as the reference landing point.",
      "source": "github-token",
      "auth_mode": "token",
      "version": "1.0.0"
    },
    {
      "id": "baidu-netdisk-token",
      "name": "百度网盘（自备 Access Token）",
      "name_en": "Baidu Netdisk (bring your own Access Token)",
      "description": "连接百度网盘，浏览与检索文件、管理目录、创建分享链接、查询容量。凭据由用户自备 Access Token。与官方 baidu-netdisk 条目同一个远端服务，差别只在认证方式。",
      "description_en": "Connect to Baidu Netdisk to browse and search files, manage folders, create share links and check quota. Bring your own Access Token. Same remote server as the official baidu-netdisk entry; only the auth differs.",
      "source": "baidu-netdisk-token",
      "auth_mode": "token",
      "version": "1.0.0"
    }
  ]
}
